<?xml version="1.0" encoding="UTF-8"?>

<xs:schema xmlns:xs="http://www.w3.org/2001/XMLSchema">

    <xs:element name="catalog">

        <xs:complexType>

            <xs:sequence>

                <xs:element name="product">

                    <xs:complexType>

                        <xs:sequence>

                            <xs:element name="catalog_item" maxOccurs="unbounded">

                                <xs:complexType>

                                    <xs:sequence>

                                        <xs:element name="item_number" type="xs:string"/>

                                        <xs:element name="price" type="xs:decimal"/>

                                        <xs:element name="size" maxOccurs="unbounded">

                                            <xs:complexType>

                                                <xs:sequence>

                                                    <xs:element name="color_swatch" maxOccurs="unbounded">

                                                        <xs:complexType mixed="true">

                                                            <xs:attribute name="image"
                                                                type="xs:string"
                                                                use="required"/>
                                                        </xs:complexType>

                                                    </xs:element>

                                                </xs:sequence>

                                                <xs:attribute name="description"
                                                    type="xs:string"
                                                    use="required"/>

                                            </xs:complexType>

                                        </xs:element>

                                    </xs:sequence>

                                    <xs:attribute name="gender"
                                        type="xs:string"
                                        use="required"/>

                                </xs:complexType>

                            </xs:element>

                        </xs:sequence>

                        <xs:attribute name="description"
                            type="xs:string"
                            use="required"/>

                        <xs:attribute name="product_image"
                            type="xs:string"
                            use="required"/>

                    </xs:complexType>

                </xs:element>

            </xs:sequence>

        </xs:complexType>

    </xs:element>

</xs:schema>